citation,version_id,prev,next,context
N.D.C.C. § 61-29-03,28238,in,thirty-four," as the bridge crossing of state highway twenty-two in section thirty-four, range ninety-five west, township o"
N.D.C.C. § 61-35-22,28311,under,the, the department of water resources of a petition under section The department may hold a hearing on the petiti
N.D.C.C. § 61-35-84,28377,in,,he manner and subject to the limitations prescribed in section
N.D.C.C. § 64-03-12,28554,under,destroy,om any weighing or measuring device is delivered under section destroy it or deliver it to the state's attorne
N.D.C.C. § 65-01-15,28574,by,officer,for an exposure to a bloodborne pathogen as defined by section officer who uses tobacco is not eligible for th
N.D.C.C. § 65-02-20,28611,or,, under this section is not subject to chapter 28-32 or section
N.D.C.C. § 65-04-15,28660,of,," except as otherwise allowed by law, is a violation of section"
N.D.C.C. § 65-04-29,28684,under,under,rying on any employment not defined as hazardous under section under this chapter is covered under the fund an
N.D.C.C. § 65-05.1-01,28689,to,,eeks of temporary total disability allowed pursuant to section
N.D.C.C. § 65-05.1-04,28693,of,occupation,riate rehabilitation option under subsection 4 or 6 of section occupation that is suited to the employee's edu
N.D.C.C. § 65-05.1-06.1,28696,of,organization,iority option is subdivision e or f of subsection 4 of section organization may award an additional award. The
N.D.C.C. § 65-05.2-02,28702,under,supplementary, claim has been accepted on an aggravation basis under section supplementary benefit must be proportionally ca
N.D.C.C. § 65-05-01.4,28709,to,,port of notice of injury on its own motion pursuant to section
N.D.C.C. § 65-05-10,28730,in,verified,benefits in cases of catastrophic injury as defined in section verified by clear and convincing objective medi
N.D.C.C. § 65-05-21,28745,of,weeks,"s compensation under the provisions of subsection 1 of section weeks' compensation. If, prior to such marriage"
N.D.C.C. § 65-06.2-08,28777,under,organization, safety and insurance account for state entities under section organization shall determine and the risk manag
N.D.C.C. § 65-08.1-02,28795,with,,uest considered by the budget section must comply with section
